{
  "schema_version": 1,
  "taxonomy_version": "taxonomy-v1",
  "ratification_status": "pending",
  "skills": [
    "python",
    "javascript",
    "typescript",
    "go",
    "rust",
    "java",
    "c",
    "cpp",
    "sql",
    "pytorch",
    "tensorflow",
    "jax",
    "llm_apis",
    "agents",
    "rag",
    "evals",
    "fine_tuning",
    "mcp",
    "vector_db",
    "prompt_engineering",
    "mlops",
    "data_pipelines",
    "kubernetes",
    "aws",
    "gcp",
    "react",
    "node",
    "postgres",
    "distributed_systems",
    "security"
  ]
}
